{
  "saif_version": "0.3.0",
  "profile": "saif-reference-node/0.3",
  "normative_scope": [
    "docs/business-object-model.md",
    "docs/request-lifecycle.md",
    "docs/provider-interface.md",
    "docs/protocol-versioning.md",
    "docs/normative-language.md",
    "docs/state-machine.md",
    "docs/saif-mcp-boundary.md",
    "docs/conformance.md",
    "docs/proposal-process.md",
    "docs/error-model.md",
    "docs/audit-event-model.md",
    "docs/reference-architecture.md",
    "docs/v0.3-roadmap.md",
    "docs/normative-requirement-matrix.md",
    "docs/specs/action-execution-semantics.md",
    "docs/specs/api-operation-semantics.md",
    "docs/specs/audit-correlation.md",
    "docs/specs/authorization-decision-contract.md",
    "docs/specs/extension-declaration.md",
    "docs/specs/operation-context.md",
    "docs/specs/security-profile.md",
    "docs/specs/status-model.md"
  ],
  "requirements": [
    {
      "requirement_id": "NR-0001",
      "keywords": [
        "MUST"
      ],
      "keyword_count": 1,
      "specification": "docs/protocol-versioning.md",
      "section": "Immutable Schema Identity",
      "source_line": 80,
      "source_digest": "sha256:08b8fcc8840f37923181ef6b9f765702708c175246f30189cc288e9144c9fc53",
      "statement": "Every normative schema release MUST declare an immutable, versioned `$id` using:",
      "schema_rules": [
        "artifact:schemas/versioned-id-and-release-tag"
      ],
      "vector_ids": [
        "governance-schema-identity-020"
      ],
      "evidence_profile": "GOVERNANCE"
    },
    {
      "requirement_id": "NR-0002",
      "keywords": [
        "MUST NOT"
      ],
      "keyword_count": 1,
      "specification": "docs/protocol-versioning.md",
      "section": "Immutable Schema Identity",
      "source_line": 92,
      "source_digest": "sha256:bcaa261a685f69fe65b3e6f9b081f6b2c6b52e11ceec6978559ef71a4f0894b0",
      "statement": "The release tag referenced by a normative schema `$id` MUST NOT be moved or",
      "schema_rules": [
        "artifact:schemas/versioned-id-and-release-tag"
      ],
      "vector_ids": [
        "governance-schema-identity-020"
      ],
      "evidence_profile": "GOVERNANCE"
    },
    {
      "requirement_id": "NR-0003",
      "keywords": [
        "MUST NOT"
      ],
      "keyword_count": 1,
      "specification": "docs/protocol-versioning.md",
      "section": "Immutable Schema Identity",
      "source_line": 94,
      "source_digest": "sha256:a4f3c8be95bace525b637eb3c50d9e5166dd101648e2ad0ed5441128ad3baa9b",
      "statement": "Default-branch and unversioned repository URLs MUST NOT be used as normative",
      "schema_rules": [
        "artifact:schemas/versioned-id-and-release-tag"
      ],
      "vector_ids": [
        "governance-schema-identity-020"
      ],
      "evidence_profile": "GOVERNANCE"
    },
    {
      "requirement_id": "NR-0004",
      "keywords": [
        "MUST"
      ],
      "keyword_count": 1,
      "specification": "docs/protocol-versioning.md",
      "section": "Immutable Schema Identity",
      "source_line": 99,
      "source_digest": "sha256:04643e204932b2ce154103b050de761e7b3b3744c6741100a4cc93a0946fd52a",
      "statement": "objects. Where an object includes `saif_version`, that value MUST match the",
      "schema_rules": [
        "artifact:schemas/versioned-id-and-release-tag"
      ],
      "vector_ids": [
        "governance-schema-identity-020"
      ],
      "evidence_profile": "GOVERNANCE"
    },
    {
      "requirement_id": "NR-0005",
      "keywords": [
        "MUST"
      ],
      "keyword_count": 1,
      "specification": "docs/normative-language.md",
      "section": "BCP 14 Declaration",
      "source_line": 10,
      "source_digest": "sha256:ef87f3debebbd8d833e0886e46656581471930e5a8d175864812b12213ab8096",
      "statement": "Within the normative scope below, the capitalized key words **MUST**,",
      "schema_rules": [
        "artifact:docs/normative-language.md#bcp-14-declaration"
      ],
      "vector_ids": [
        "governance-normative-evidence-complete-021"
      ],
      "evidence_profile": "GOVERNANCE"
    },
    {
      "requirement_id": "NR-0006",
      "keywords": [
        "MUST NOT"
      ],
      "keyword_count": 1,
      "specification": "docs/normative-language.md",
      "section": "BCP 14 Declaration",
      "source_line": 11,
      "source_digest": "sha256:a6efe9013b58686a698779e916d2210df7d43d9b002e00addcacd19cda3e5b59",
      "statement": "**MUST NOT**, **REQUIRED**, **SHALL**, **SHALL NOT**, **SHOULD**,",
      "schema_rules": [
        "artifact:docs/normative-language.md#bcp-14-declaration"
      ],
      "vector_ids": [
        "governance-normative-evidence-complete-021"
      ],
      "evidence_profile": "GOVERNANCE"
    },
    {
      "requirement_id": "NR-0007",
      "keywords": [
        "MUST",
        "MUST NOT"
      ],
      "keyword_count": 2,
      "specification": "docs/normative-language.md",
      "section": "Requirement Use",
      "source_line": 57,
      "source_digest": "sha256:718ad9c1ecc2397bca548ae4489fed5c4100bfc421121fd056bc4e5d732c2ce8",
      "statement": "A **MUST** or **MUST NOT** requirement requires deterministic conformance",
      "schema_rules": [
        "artifact:docs/normative-language.md#bcp-14-declaration"
      ],
      "vector_ids": [
        "governance-normative-evidence-complete-021"
      ],
      "evidence_profile": "GOVERNANCE"
    },
    {
      "requirement_id": "NR-0008",
      "keywords": [
        "MUST"
      ],
      "keyword_count": 1,
      "specification": "docs/conformance.md",
      "section": "Vector Taxonomy",
      "source_line": 80,
      "source_digest": "sha256:fc04a5983433c09ac9804a6d12ec9e0024addfedc828987a374a91f5619617a5",
      "statement": "directory communicates expected validity; the `expected` field MUST agree with",
      "schema_rules": [
        "schemas/conformance-vector.schema.json#"
      ],
      "vector_ids": [
        "request-valid-001",
        "request-invalid-001"
      ],
      "evidence_profile": "GOVERNANCE"
    },
    {
      "requirement_id": "NR-0009",
      "keywords": [
        "MUST"
      ],
      "keyword_count": 2,
      "specification": "docs/conformance.md",
      "section": "Vector Taxonomy",
      "source_line": 83,
      "source_digest": "sha256:519e8240c76c8caa13eb0642982e63c72d051b3bf35d956d4cc39deadc02b362",
      "statement": "Every invalid vector MUST identify one primary failure. Supporting context MUST",
      "schema_rules": [
        "schemas/conformance-vector.schema.json#"
      ],
      "vector_ids": [
        "request-valid-001",
        "request-invalid-001"
      ],
      "evidence_profile": "GOVERNANCE"
    },
    {
      "requirement_id": "NR-0010",
      "keywords": [
        "MUST"
      ],
      "keyword_count": 1,
      "specification": "docs/conformance.md",
      "section": "Vector Taxonomy",
      "source_line": 85,
      "source_digest": "sha256:8c868e1c1f13453a1b9dcef37495ab7cfe89c054af50dad19523db3bdc2f29d3",
      "statement": "applicable specification MUST define error precedence before the vector can be",
      "schema_rules": [
        "schemas/conformance-vector.schema.json#"
      ],
      "vector_ids": [
        "request-valid-001",
        "request-invalid-001"
      ],
      "evidence_profile": "GOVERNANCE"
    },
    {
      "requirement_id": "NR-0011",
      "keywords": [
        "MUST"
      ],
      "keyword_count": 1,
      "specification": "docs/conformance.md",
      "section": "Standard Error Taxonomy",
      "source_line": 90,
      "source_digest": "sha256:b2c082f227f0060b6f817298f9e0c4fa239926c059c007819ce86fece9af95c5",
      "statement": "`expected_error.category` MUST use exactly one Standard Error Model category:",
      "schema_rules": [
        "schemas/conformance-vector.schema.json#/properties/expected_error"
      ],
      "vector_ids": [
        "error-standard-shape-001",
        "error-nonstandard-category-001"
      ],
      "evidence_profile": "GOVERNANCE"
    },
    {
      "requirement_id": "NR-0012",
      "keywords": [
        "MUST"
      ],
      "keyword_count": 1,
      "specification": "docs/conformance.md",
      "section": "Canonical Error Path",
      "source_line": 114,
      "source_digest": "sha256:fdadc33b497790c4760eacd645323d93d888985668bda91fcbf2782d515ff8f6",
      "statement": "failure. Runners MUST compare the reported pointer exactly after JSON Pointer",
      "schema_rules": [
        "schemas/conformance-vector.schema.json#/properties/expected_error/properties/path"
      ],
      "vector_ids": [
        "status-layer-confusion-001",
        "error-standard-shape-001"
      ],
      "evidence_profile": "GOVERNANCE"
    },
    {
      "requirement_id": "NR-0013",
      "keywords": [
        "MUST NOT"
      ],
      "keyword_count": 1,
      "specification": "docs/conformance.md",
      "section": "Canonical Error Path",
      "source_line": 115,
      "source_digest": "sha256:4153ad6afd1a5f18d2dc885a66251e8e6926442b794d90c511a047408c4b0631",
      "statement": "escaping; they MUST NOT infer an implementation-specific object path.",
      "schema_rules": [
        "schemas/conformance-vector.schema.json#/properties/expected_error/properties/path"
      ],
      "vector_ids": [
        "status-layer-confusion-001",
        "error-standard-shape-001"
      ],
      "evidence_profile": "GOVERNANCE"
    },
    {
      "requirement_id": "NR-0014",
      "keywords": [
        "MUST"
      ],
      "keyword_count": 1,
      "specification": "docs/conformance.md",
      "section": "v0.3 Reference Node Coverage",
      "source_line": 207,
      "source_digest": "sha256:3f4a61fcd67d9b92fb4ab7a9c613ea8517486293b19df30c2b397f91d804e410",
      "statement": "A coverage report MUST list each matrix row, the vectors executed for that row,",
      "schema_rules": [
        "artifact:conformance/normative-requirements-v0.3.json"
      ],
      "vector_ids": [